,description,maintext,source_domain,title,url,language,date_publish,region,title_len,text_len,all_frames,all_text_to_highlight
100,Explosions are being heard around a main hospital in Gaza City as the Israeli military enters a new phase of the war. CBS News foreign correspondent Debora Patta reports.,"Heavy fighting, strikes reported near Gaza hospitals Explosions are being heard around a main hospital in Gaza City as the Israeli military enters a new phase of the war. CBS News foreign correspondent Debora Patta reports.",www.cbsnews.com,"Heavy fighting, strikes reported near Gaza hospitals",https://www.cbsnews.com/video/heavy-fighting-strikes-reported-near-gaza-hospitals/,en,2023-11-10 20:40:00,US,7,36,"['Hostile_encounter', 'Attack', 'Buildings', 'Buildings', 'Hostile_encounter']","['Heavy', 'near Gaza hospitals', 'hospitals', 'hospital', 'in Gaza City']"
101,Israel's military says it has expanded its ground operations to every part of Gaza in pursuit of Hamas.,"Israel ramps up Gaza ground assault Israel ramps up ground assault as more than 100 hostages remain in Gaza 02:52
The Israeli military said Sunday its ground offensive had expanded to every part of Gaza, and it ordered more evacuations in the crowded south while vowing that operations there against Hamas would carry ""no less strength"" than its shattering ones in the north.
Heavy bombardment followed evacuation orders, and Palestinians said they were running out of places to go in the sealed-off territory bordering Israel and Egypt. Many of Gaza's 2.3 million people are crammed into the south after Israel ordered civilians to leave the north in the early days of the war, which was sparked by the Oct. 7 Hamas-led attack in Israel that killed about 1,200, mostly civilians.
The United Nations estimates that 1.8 million Palestinians in Gaza have been displaced. Nearly 958,000 of them are in 99 U.N. facilities in the south, said Juliette Toma, director of communications at the U.N. agency for Palestinian refugees.
After dark, gunfire and shelling were heard in the central town of Deir al-Balah as flares lit the sky. In Gaza's second-largest city of Khan Younis, Israeli drones buzzed overhead. U.N. human rights chief Volker Türk urged an end to the war, saying civilian suffering was ""too much to bear.""
Israeli flares light the sky above Khan Yunis in the southern Gaza Strip, on December 3, 2023, as fighting resumed after the expiration of a seven-day truce between Israel and Hamas militants. SAID KHATIB/AFP via Getty Images
The Health Ministry in Hamas-run Gaza said the number of people killed there since Oct. 7 has surpassed 15,500, with more than 41,000 wounded. The ministry does not differentiate between civilian and combatant deaths, but said 70% of the dead were women and children.
A Health Ministry spokesman asserted that hundreds had been killed or wounded since a weeklong cease-fire ended Friday. ""The majority of victims are still under the rubble,"" Ashraf al-Qidra said.
Fears of a wider conflict intensified. A U.S. warship and multiple commercial ships responded to distress signals from container ships in the Red Sea, the Pentagon said. Yemen's Iran-backed Houthi rebels claimed attacks on two ships they described as being linked to Israel but did not acknowledge targeting a U.S. vessel.
Hopes for another temporary truce in Gaza were fading. The cease-fire facilitated the release of dozens of the roughly 240 Gaza-held Israeli and foreign hostages in exchange for Palestinians imprisoned by Israel. But Israel has called its negotiators home and Prime Minister Benjamin Netanyahu says the war will continue until ""all its goals"" are achieved. One is to remove Hamas from power in Gaza.
Senior Hamas official Osama Hamdan said resuming talks with Israel on further exchanges must be tied to a permanent cease-fire.
White House National Security Council spokesman John Kirby told ""Face the Nation"" on CBS News that the U.S. is ""trying to work hour by hour to see if we can get this pause reinstated and get those hostages out.""
""While the pause has been lifted, and no hostage exchanges are going on, what is still going on, importantly, is humanitarian assistance getting in, including fuel, which is critical,"" Kirby added.
Israel's military widened evacuation orders in and around Khan Younis in the south, telling residents of at least five more areas to leave. Residents said the military dropped leaflets calling Khan Younis ""a dangerous combat zone"" and ordering them to move to the border city of Rafah or a coastal area in the southwest.
But Halima Abdel-Rahman, a widow and mother of four, said she won't heed such orders anymore. She fled her home in October to an area outside Khan Younis, where she stays with relatives.
""The occupation tells you to go to this area, then they bomb it,"" she said by phone. ""The reality is that no place is safe in Gaza. They kill people in the north. They kill people in the south.""
The United States, Israel's closest ally, has urged Israel to avoid significant new mass displacement and do more to protect civilians. U.S. Vice President Kamala Harris told Egypt's president that ""under no circumstances"" would the U.S. permit the forced relocation of Palestinians from Gaza or the West Bank, an ongoing siege of Gaza or the redrawing of its borders.
On the ground in Gaza, there was fear and mourning. Outside a Gaza City hospital, a dust-covered boy named Saaed Khalid Shehta dropped to his knees beside the bloodied body of his little brother Mohammad, one of several bodies laid out after people said their street was hit by airstrikes. He kissed him.
""You bury me with him!"" the boy cried. A health worker at Al-Ahli Baptist Hospital said more than 15 children were killed.
Palestinian citizens inspect the destruction caused by air strikes on their homes on December 03, 2023, in Khan Yunis, Gaza. Ahmad Hasaballah / Getty Images
Israel's military said its fighter jets and helicopters struck targets in Gaza including ""tunnel shafts, command centers and weapons storage facilities."" It acknowledged ""extensive aerial attacks in the Khan Younis area.""
The bodies of 31 people killed in bombardment of central Gaza were taken to the Al-Aqsa hospital in Deir al-Balah, said Omar al-Darawi, a hospital administrative employee. One woman wept, cradling a child's body. Another carried the body of a baby. Later, hospital workers reported 11 more dead after another airstrike. Bloodied survivors included a child carried in on a mattress.
Outside a hospital morgue in Khan Younis, resident Samy al-Najeila carried the body of a child. He said his sons had been preparing to evacuate their home, ""but the occupation didn't give us any time. The three-floor building was destroyed completely, the whole block was totally destroyed."" He said six of the bodies were his relatives.
""Five people are still under the rubble,"" he said. ""God help us.""
In a video from the same crowded al-Nasser hospital, UNICEF spokesperson James Elder said: ""I feel like I'm almost failing in my ability to convey the endless killing of children here.""
Israel says it does not target civilians and has taken measures to protect them, including its evacuation orders. In addition to leaflets, the military has used phone calls and radio and TV broadcasts to urge people to move from specific areas.
Israel says it targets Hamas operatives and blames civilian casualties on the militants, accusing them of operating in residential neighborhoods. It claims to have killed thousands of militants, without providing evidence. Israel says at least 78 of its soldiers have been killed.
Kirby said that the U.S. is in discussion with Israel ""about being careful, precise and deliberate in their targeting and trying to minimize civilian casualties to the maximum extent possible.""
""I think it's also important for people to remember what they're up against here. Hamas deliberately shelters themselves inside residential buildings, hospitals and schools,"" Kirby said when asked by ""Face the Nation"" host Margaret Brennan if the White House has established ""red lines"" in the terms of U.S. military aid to Israel.
""It's an added burden that Israel has as a modern military, we recognize that, but it's also a very difficult burden and obstacle for them to overcome,"" Kirby said.
The widening offensive likely will further complicate humanitarian aid to Gaza. Wael Abu Omar, a spokesman for the Palestinian Crossings Authority, said 100 aid trucks entered Sunday, but U.N. agencies have said 500 trucks per day on average entered before the war.
The renewed hostilities also heightened concerns for the 137 hostages the Israeli military believes are still being held by Hamas. During the recent truce, 105 hostages were freed, and Israel released 240 Palestinian prisoners. Most of those released by both sides were women and children.
Elsewhere in the region, Lebanon's militant Hezbollah group said it struck Israeli positions near the tense Lebanon-Israel border. Eight soldiers and three civilians were wounded by Hezbollah fire in the area of Beit Hillel, army radio reported. The military said its artillery struck sources of fire from Lebanon and its fighter jets struck other Hezbollah targets.
Iraqi militants with the Iran-backed umbrella group the Islamic Resistance in Iraq said they struck the Kharab al-Jir U.S. military base in Syria with rockets. A U.S. military official, speaking on condition of anonymity in line with regulations, said rockets hit Rumalyn Landing Zone in Syria but there were no reports of casualties or damage.
Later Sunday, officials with Iranian-backed militias in Iraq said five militia members were killed in an airstrike blamed on the U.S. near Kirkuk. The officials spoke on condition of anonymity because they were not authorized to comment publicly. U.S. military officials could not immediately be reached for comment. for comment.",www.cbsnews.com,"Israel expands Gaza ground offensive, says efforts in south will carry ""no less strength"" than in north",https://www.cbsnews.com/miami/news/israel-expands-gaza-ground-offensive-south-widens-evacuation-orders/,en,2023-12-03 17:58:00,US,17,1418,"['Hostile_encounter', 'Attack', 'Killing', 'Hostile_encounter', 'Hostile_encounter', 'Killing', 'Death', 'Quantified_mass', 'Killing', 'Hostile_encounter', 'Hostile_encounter', 'Quantified_mass', 'Attack', 'Quantified_mass', 'Hostile_encounter', 'Buildings', 'Killing', 'Killing', 'Buildings', 'Killing', 'Destroying', 'Attack', 'Buildings', 'Attack', 'Attack', 'Killing', 'Buildings', 'Buildings', 'Buildings', 'Buildings', 'Buildings', 'Buildings', 'Buildings', 'Destroying', 'Destroying', 'Buildings', 'Killing', 'Killing', 'Killing', 'Buildings', 'Buildings', 'Attack', 'Hostile_encounter', 'Attack', 'Killing']","['Oct. 7', 'Hamas-led', 'in Israel', 'that', 'about 1,200, mostly civilians', 'people', 'there', 'since Oct. 7', 'civilian and combatant', 'hundreds', 'hundreds', 'since a weeklong cease-fire ended Friday', 'wider', 'U.S.', 'multiple', 'commercial ships', ""Yemen's Iran-backed Houthi rebels"", 'on two ships', 'dozens', 'of the roughly 240 Gaza-held Israeli and foreign hostages', 'home', 'They', 'people in the north', 'They', 'people in the south', 'Gaza City', 'hospital', 'more than 15 children', 'caused by air strikes on their homes on December 03, 2023, in Khan Yunis, Gaza', 'air', 'on their homes', 'on December 03, 2023', 'in Khan Yunis, Gaza', 'homes', 'its fighter jets and helicopters', 'targets in Gaza including ""tunnel shafts, command centers and weapons storage facilities', 'aerial', 'in the Khan Younis area', '31 people', 'in bombardment of central Gaza', 'Al-Aqsa', 'hospital', 'in Deir al-Balah', 'hospital', 'hospital', 'hospital', 'morgue', 'in Khan Younis', 'home', 'three-floor', 'building', 'The three-floor building', 'completely', 'the whole block', 'totally', 'al-Nasser', 'hospital', 'of children', 'It', 'thousands of militants', 'at least 78 of its soldiers', 'residential', 'buildings', 'hospitals', 'it', 'Israeli positions near the tense Lebanon-Israel border', 'five militia members', 'in an airstrike blamed on the U.S. near Kirkuk']"
102,"Appearing Tuesday on Fox & Friends, Fox News foreign correspondent Trey Yingst said Hamas officials have flat out lied to him.","Appearing Tuesday on Fox & Friends, Fox News foreign correspondent Trey Yingst said Hamas officials have flat out lied to him when he has sought information from the Palestinian terror organization amid its ongoing war with Israel.
A partial transcript is as follows:
LAWRENCE JONES: How difficult is it to make that contact with Hamas? Because all the American people are wondering, “where are the Americans being released?”
TREY YINGST: It’s a great question because when we talk with Hamas officials, they become increasingly frustrated throughout the war as I continue to question them over the phone and over text messages about what they did on October 7th. They have gone as far as to blatantly lie when presented with evidence because they simply don’t want to tell the truth about what took place here. We’re able to make contact and get comment from them about this ongoing conflict. But in terms of the information they’re providing, we often will not actually bring to air what they are telling us because I can’t confirm it. A lot of times, they’re lying. And so we do reach out. We try to do our due diligence on these stories and get as many perspectives and angles as possible. But when you’re dealing with a terror organization, it’s very challenging to get them to tell the truth and to provide accurate information.",www.breitbart.com,Hamas Has Blatantly Lied to Me,https://www.breitbart.com/the-media/2023/11/28/fox-newss-trey-yingst-hamas-has-blatantly-lied-to-me/,en,2023-11-28 22:39:12,US,6,226,"['Hostile_encounter', 'Quantified_mass', 'Hostile_encounter', 'Hostile_encounter', 'Quantified_mass', 'Quantified_mass']","['its', 'ongoing', 'with Israel', 'all', 'the American people', 'ongoing', 'A lot', 'of times', 'A lot', 'of times']"
103,"Israel has upgraded its travel warning for Australia, pointing to ""rising incitement"" against Jews driven by the October 7 Hamas terrorist attack.","Israel has upgraded its travel warning for Australia, pointing to “rising incitement” against Jews driven by the October 7 Hamas terrorist attack for the change.
Israel’s National Security Council issued new travel advice for dozens of countries amid ongoing concern for the safety of Israeli citizens travelling overseas, the Australian Financial Review reports.
Australia was included among a swath of countries for which travel advice was raised to “Level 2”, recommending Israelis take extra precautions when visiting.
The U.S. remains at Level 1, or no threat.
South Africa, Eritrea, Uzbekistan, Kazakhstan, Kyrgyzstan and Turkmenistan are among countries that Israelis are being told to avoid. The council said threats against Jews are rising across the world:
Since the beginning of the war, there have been increased efforts identified from Iran and its affiliates, including Hamas and Islamic Jihad, to target Israelis and Jews around the world. On this basis, along with the rising levels of incitement, attempted attacks and antisemitism around the world, the National Security Council has reiterated its recommendation for Israelis to reconsider any non-essential travel at this time.
Those who do travel are being told to avoid showing any external signs identifying them as Israeli or Jewish.
A number of pro-Palestinian rallies in Australia have included antisemitic threats and abuse, including a massed gathering in Sydney two days after the October 7 Hamas terror attack where protesters chanted “Gas the Jews” amongst other slurs.
UNCUT VERSION – SHOCKING ""Gas the Jews' on the steps of the Sydney Opera House pic.twitter.com/kLv9QMex65 — Australian Jewish Association (@AustralianJA) October 9, 2023
On another occasion a wild mob of pro-Palestinian demonstrators targeted a Melbourne hotel where Israeli family members of murder victims and hostages of the attack had been staying.
As Breitbart News reported, the activists, armed with flags and signs with anti-Israel messages, had tracked the Israeli supporters to their hotel in the Victorian state capital.
The protesters, some wearing Palestinian keffiyeh headscarves, unfurled signs reading “Stop Arming Israel, Free Palestine” and “Zionism is Fascism” and placed fake babies covered in blood across the hotel lobby while shouting insults through a loudspeaker.
Pro-Palestinian Mob Swamps Hotel, Besieges Israeli Relatives of Hamas Hostages https://t.co/YEpjKi4RRp — Breitbart London (@BreitbartLondon) November 30, 2023
A solemn Bondi Beach memorial dedicated to Israeli hostages being held by Hamas terrorists has also been attacked, with two men caught ripping down posters that were a key to the display.
More than 230 blue and white towels, the colors of the Israeli flag, were draped over the railings at the iconic Sydney beach along with photographs of the hostages believed to be still in Gaza, and posters, saying “Kidnapped.”
Footage emerged of two men attempting to take down posters of the hostages while being confronted by a larger group who stepped forward to challenge them.
Watch: Bondi Beach Tribute to Hostages Held by Hamas VANDALIZED
The Executive Council of Australian Jewry co-chief, Alex Ryvchin, said the vandalism went against Australian values including the right to peaceful, dignified displays.
The Australian government has warned Jewish people to stay away from pro-Hamas celebrations.",www.breitbart.com,Israel Upgrades Travel Warning for Australia amid Rising Antisemitism,https://www.breitbart.com/europe/2023/12/06/israel-upgrades-travel-warning-for-australia-amid-rising-antisemitism/,en,2023-12-06 09:38:48,US,9,494,"['Terrorism', 'Attack', 'Quantified_mass', 'Hostile_encounter', 'Attack', 'Quantified_mass', 'Attack', 'Buildings', 'Attack', 'Buildings', 'Buildings', 'Terrorism', 'Attack', 'Hostile_encounter']","['terrorist', 'October 7', 'Hamas terrorist', 'dozens', 'of countries', 'number', 'of pro-Palestinian rallies in Australia', 'October 7', 'Hamas', 'terror', 'Melbourne', 'hotel', 'hotel', 'in the Victorian state capital', 'hotel', 'Hamas', 'terrorists', 'A solemn Bondi Beach memorial dedicated to Israeli hostages being held by Hamas terrorists', 'two men', 'by a larger group who stepped forward to challenge them']"
104,"A group of Oakland teachers are planning a ""teach-in"" Wednesday that shows the ongoing Israel-Hamas conflict and its history through a Palestinian perspective.","Possible teach-in at Oakland schools would have pro-Palestine curriculum
Possible teach-in at Oakland schools would have pro-Palestine curriculum
Possible teach-in at Oakland schools would have pro-Palestine curriculum
OAKLAND — A group of Oakland teachers are planning a ""teach-in"" Wednesday that shows the ongoing Israel-Hamas conflict and its history through a Palestinian perspective.
The demonstration is causing local parents to consider holding their kids back from schools during the lesson plan but not all teachers will be participating.
CBS News Bay Area obtained a Google document that details the proposed curriculum for Oakland students ages kindergarten through high school to learn about the centuries-old conflict.
""Know that our outrage is noble and just. Our power is building and you can play a big role in that,"" states a Youtube video that encourages teachers to participate.
It's not clear who created or published the video.
ALSO READ: Oakland Unified superintendent takes stand against planned teach-in on war in Gaza
""It's devastating to Oakland families, especially Jewish families,"" Rabbi Dovid Labkowski of Chabad Oakland, told CBS News Bay Area. ""Education is about teaching right from wrong, morals and values, when you decide you don't like something happening in the world and you decide to put together a curriculum that's going to teach about hating other people that's what this is about, this is about hating Jews.""
He said the teach-in deepens antisemitism in a city that he says has never experienced such hate.
""What it does I think is that it means people who look Jewish will be targeted,"" Lobkowski explained. ""Antisemitism was never really a factor here in Oakland; we have one of the most diverse populations in the country. It's a great place to live, great place for families, but this antisemitism is devastating.""
The lesson plan comes from a group called OEA for Palestine. It's a group of teachers who want to use the day to teach about Palestinian liberation.
Their material and the teach-in are not backed by the Oakland school district, but local CAIR president Zahara Billoo said it presents an opportunity for current events to be taught.
""This is important this is necessary to teach kids about current events is frankly what it comes down to,"" Billoo told CBS News Bay Area.
The suggested curriculum mentions the term intifada which is an arabic word for rebellion that has often been linked to violent uprisings.
But Billoo sees the teach-in as an opportunity to promote inclusion.
""Some of the first complaints we received were of students feeling alienated and targeted at schools,"" she explained, ""so when I heard I was excited, and I thought this is a good opportunity to counter some of the misinformation about Israel.""
But for Labkowski, he believes leaving out Israel's perspective may be harmful to the Jewish community, particularly in the days before Hanukkah.
""Lighting up the world and fighting the darkness that's what Hanukkah is about,"" he said. ""It was the few against the many and that's what it's about today, kindness brings kindness, hate brings hate but positivity brings positivity.""
Oakland Unified School District superintendent Dr. Kyla Johnson-Trammell said in a statement that ""the District does not authorize this action. Furthermore, I want to make clear that the instructional materials developed and shared by the teach-in organizers are not aligned with the materials and guidance previously provided by our Chief Academic Officer, Dr. Sondra Aguilera.""",www.cbsnews.com,Planned teach-in at Oakland schools would present Palestinian perspective to students,https://www.cbsnews.com/sanfrancisco/news/possible-teach-in-at-oakland-schools-would-present-palestinian-perspective-to-students/,en,2023-12-04 18:38:00,US,11,544,"['Hostile_encounter', 'Hostile_encounter', 'Hostile_encounter']","['ongoing', 'Israel-Hamas', 'centuries-old', 'in Gaza']"
