,description,maintext,source_domain,title,url,language,date_publish,region,title_len,text_len,all_frames,all_text_to_highlight
105,"Three college students described as being of Palestinian descent were shot Saturday evening in Burlington, Vermont, while visiting for Thanksgiving.","3 Palestinian students shot in Vermont Suspect arrested in shooting of 3 Palestinian students in Burlington, Vermont 02:12
Update: The suspect has been charged with three counts of attempted murder in the second degree. Read the latest here. Our earlier story is below.
Burlington, Vermont, police have arrested a white man who is suspected of shooting three 20-year-old college students of Palestinian descent on Saturday, police said.
The three men were in Burlington visiting the home of one of the victim's relatives for Thanksgiving, police said. They were on Prospect Street when an armed white man confronted them and, without speaking, allegedly discharged at least four rounds around 6:30 p.m. ET.
Two of the victims were shot in the torso while the third man was shot in his lower extremities, police said. Two of the victims were in what police described as stable condition. The third victim ""sustained much more serious injuries.""
Two of the victims were wearing keffiyehs, scarfs that have come to symbolize Palestinian solidarity, officials said. Police said two of the victims are U.S. citizens and one is a legal resident.
Police detained Jason J. Eaton, 48, around 3:30 p.m. Sunday, Burlington police said Sunday night.
Evidence collected during a search of Eaton's home several hours after he was detained ""gave investigators and prosecutors probable cause to believe that Mr. Eaton perpetrated the shooting,"" police said. He was then arrested and is scheduled to be arraigned Monday, police said.
Police did not immediately provide any information on a possible motive.
Jason Eaton Burlington Police Department
The U.S. Attorney's Office in Vermont on Sunday night said it was investigating to determine whether a federal crime had been committed.
""We recognize the suffering and heartbreak that the three men who were wounded, their families, and their communities are experiencing,"" Nikolas P. Kerest, U.S. Attorney for Vermont, said in a statement.
The FBI Albany field office said Sunday night it was also investigating the shooting.
President Biden on Monday said he and first lady Jill Biden were ""horrified"" by the shooting. The three young men ""were simply spending Thanksgiving gathered with family and loved ones,"" Mr. Biden wrote in a statement, adding, ""While we are waiting for more facts, we know this: there is absolutely no place for violence or hate in America. Period.""
Investigators don't know as much as they'd like, Burlington police chief Jon Murad said on Sunday. He urged the public to avoid jumping to conclusions ""based on statements from uninvolved parties who know even less.""
""In this charged moment, no one can look at this incident and not suspect that it may have been a hate-motivated crime,"" Murad said. ""And I have already been in touch with federal investigatory and prosecutorial partners to prepare for that if it's proven. But now that the victims are safe and receiving medical care, our next priority is identifying, locating, and apprehending the suspect. We're working every investigatory angle on this case, and will continue to provide reliable, factual information to public while protecting the victims and our investigation.""
Police did not identify the victims by name, but the victim's families later identified them in a statement. All three victims attended Ramallah Friends School, a Quaker-run private nonprofit school in Ramallah. Currently, Hisham Awartani is a student at Brown University, Kinnan Abdalhamid is a student at Haverford College and Tahseen Ahmad is a student at Trinity College, according to their family members.
From left to right, Tahseen Ali Ahmad, Kinnan Abdalhamid and Hisham Awartani are shown.
""As parents, we are devastated by the horrific news that our children were targeted and shot in Burlington, VT. At this time, our primary concern is their full recovery and that they receive the critical medical support they need to survive. We are extremely concerned about the safety and well-being of our children,"" the parents said in a joint statement.
""We call on law enforcement to conduct a thorough investigation, including treating this as a hate crime,"" the parents said. ""We will not be comfortable until the shooter is brought to justice. We need to ensure that our children are protected, and this heinous crime is not repeated. No family should ever have to endure this pain and agony. Our children are dedicated students who deserve to be able to focus on their studies and building their futures.""
Awartani's uncle, Rich Price, told CBS Boston station WBZ-TV the three students were spending the holiday weekend with his family in Burlington when it happened.
""We were so happy to have them visit us for Thanksgiving,"" said Price.
""They grew up in the occupied West Bank under military control... they just couldn't imagine this could happen in a place like Vermont,"" he said. He told the station the thee students had gone for a walk in the neighborhood Saturday after returning from an 8th birthday party for Price's twin boys.
""They were approached by this individual who pulled a handgun on them and shot all three of them,"" Price said.
Haverford's president and dean shared a joint statement about the shooting on Sunday.
""Kinnan and his friends are all Palestinian students studying at U.S. colleges and universities,"" they wrote. ""Police are investigating the shootings, and we await word on whether it will be pursued as a hate crime.""
Trinity's president and vice president also shared a joint statement, saying they were ""heartbroken"" to learn Ahmad was one of the victims of gun violence.
""A member of the Trinity Student Life staff went to Vermont early this morning to provide support and reports that Tahseen wants the Trinity community to know that he is in stable condition at an area hospital, and that he is aware this message is being released,"" they wrote.
Awartani remained hospitalized Sunday, Brown University President Christina H. Paxson said in a statement. He is expected to survive his injuries.
""There are not enough words to express the deep anguish I feel for Hisham, his parents and family members, and his friends. I know that this heinous and despicable act of violence — this latest evidence of anti-Arab and anti-Palestinian discrimination and hate spiraling across this country and around the world — will leave many in our community deeply shaken,"" Paxson said. ""The family has given us permission to share that Hisham Awartani, a junior at Brown, remains hospitalized, and we were very relieved and grateful to learn that he is expected to survive his injuries.""
The American-Arab Anti-Discrimination Committee said it has ""reason to believe this shooting occurred because the victims are Arab.""
""We are praying for a full recovery of the victims, and will stand by to support the families in any way that is needed,"" said ADC National Executive Director Abed Ayoub. ""Given the information collected and provided, it is clear that the hate was a motivating factor in this shooting, and we call on law enforcement to investigate it as such. The surge in anti-Arab and anti-Palestinian sentiment we are experiencing is unprecedented, and this is another example of that hate turning violent.""
A White House official on Sunday said President Biden had been briefed on the shooting.
Sen. Bernie Sanders responded to the shooting in a post on social media.
""It is shocking and deeply upsetting that three young Palestinians were shot here in Burlington, VT,"" he said. ""Hate has no place here, or anywhere. I look forward to a full investigation. My thoughts are with them and their families.""
Saturday's shooting comes more than a month after the stabbing death of a 6-year-old Palestinian boy in the Chicago area. The Council on American-Islamic Relations, which describes itself as the country's largest Muslim civil rights and advocacy organization, in early November said there'd been an ""unprecedented surge"" in anti-Arab and anti-Muslim bias incidents reported in the U.S. since the start of the Israel-Hamas war.",www.cbsnews.com,"Arrest made after 3 Palestinian college students shot in Burlington, Vermont, police say",https://www.cbsnews.com/newyork/news/palestinian-students-shot-burlington-vermont-hisham-awartani-kinnan-abdalhamid-tahseen-ahmed/,en,2023-11-26 14:31:00,US,13,1271,"['Buildings', 'Hostile_encounter', 'Buildings', 'Committing_crime', 'Killing', 'Committing_crime', 'Committing_crime', 'Killing', 'Committing_crime', 'Committing_crime', 'Committing_crime', 'Quantified_mass', 'Killing', 'Committing_crime', 'Buildings', 'Quantified_mass', 'Killing', 'Killing', 'Death', 'Hostile_encounter']","['home', ""of one of the victim's relatives"", 'when', 'an armed white man', 'them', 'home', 'Mr. Eaton', 'the shooting', 'Mr. Eaton', 'federal', 'crime', 'a federal crime', 'crime', 'crime', 'crime', 'all', 'Palestinian students studying at U.S. colleges and universities', 'crime', 'hospital', 'many', 'in our community', ""Saturday's"", 'stabbing', 'of a 6-year-old Palestinian boy', 'in the Chicago area', 'Israel-Hamas']"
106,The Ventura County Sheriff's Department has arrested computer science professor and pro-Palestinian protester Loay Alnaji in the death of Jewish man Paul Kessler.,"Police have arrested a pro-Palestinian California college professor in the death of a 69-year-old Jewish man at concurrent pro-Israel and pro-Palestinian demonstrations on Nov. 5.
Loay Abdelfattah Alnaji, 50, was taken into custody on Thursday, charged with involuntary manslaughter and battery causing great body injury and incarcerated at Ventura County Jail on $1,000,000 bail, according to a Ventura County Sheriff's Department press release. Both charges have ""special allegations that Alnaji personally inflicted great bodily injury,"" the release said.
""We're not providing any additional information at this moment in time, however there will be additional information released later today,"" Sgt. Rob Yoos told Fox News Digital on Thursday morning.
Investigators with the department allege that Alnaji caused pro-Israel protester Paul Kessler to knock his head onto the concrete when he fell, which resulted in brain hemorrhaging that would kill him hours later in the hospital.
PRO-PALESTINIAN PROTESTER 'TRIED TO BAIT' ELDERLY JEWISH MAN BEFORE FATAL ALTERCATION, WITNESS SAYS
Although police previously obtained a warrant to search Alnaji's vehicle and home in Moorpark on Nov. 6, detaining the then-suspect for about two hours, they had insufficient evidence to carry out an arrest.
It is unclear what new evidence led to Alnaji's arrest. In the weeks preceding his arrest, some witnesses have told Fox News Digital that the pro-Palestinian protester struck Kessler with his megaphone. An autopsy carried out by Ventura County Medical Examiner Christopher Young showed minor abrasions to the left side of Kessler's mouth in addition to the brain swelling and bruising that killed him.
The Ventura County Sheriff's Department and District Attorney's office have scheduled a press conference Friday on the investigation, the agencies said.
HUNDREDS HONOR JEWISH MAN PAUL KESSLER KILLED IN CLASH WITH PRO-PALESTINIAN PROTESTER: 'WE WANT JUSTICE'
The department wrote that they are still crowdsourcing photos and video from 3 p.m. and 4 p.m. at the intersections of Westlake and Thousand Oaks Boulevards, and offering a $1,000 reward for any pertinent footage or information.
Alnaji is a full-time professor teaching computer science at Ventura County Community College's Moorpark campus. The school did not immediately return Fox News Digital's request for comment.
He was born in Kuwait, according to the Ventura County District Attorney's office. His citizenship status is not currently clear.
JEWISH MAN'S DEATH AT CALIFORNIA RALLY COMPLICATED BY CONFLICTING WITNESS ACCOUNTS
Alnaji has taught college students since 2003 and holds bachelor's and master's degrees in computer science and a doctorate in business administration, per his since-removed faculty page and linked YouTube introduction that has since been removed.
ELDERLY JEWISH MAN DIED IN CONFRONTATION WITH PRO-PALESTINIAN PROTESTER AT CALIFORNIA RALLY
On his now-deleted Instagram, Alnaji reposted a video in which activist Shahid King Bolsen compares the Hamas terrorist group to civil rights leaders Nelson Mandela and Mahatma Gandhi:
""If someone asked me to condemn Hamas I would say, what's the rush?"" Bolsen said in the video Alnaji shared. ""Let's let history decide.""
NBC NEWS CHANGES HEADLINE AFTER OMITTING MAN KILLED AT PRO-PALESTINIAN PROTEST WAS JEWISH
""Let's wait to see because you might change your mind on this, too — you condemned Mahatma Gandhi until you didn't,"" Bolsen said in the video shared by Alnaji.
In footage capturing the aftermath of the altercation between Alnaji and Kessler, the latter man can be seen bleeding on the ground.
Alnaji sits feet away on a curb, and can be seen answering a police officer's questions. At a press conference on Nov. 7, Ventura County Sheriff James Fryhoff said that the then-unnamed suspect was cooperative.
Later, Alnaji can be seen looking on as Kessler is pulled into a waiting ambulance on a gurney.
ISRAEL PUSHES DEEPER INTO GAZA AS UN ESTIMATES 15,000 FLEE SOUTH
Witnesses at the scene have told Fox News Digital that Alnaji ""tried to bait"" Kessler before their altercation and was using a megaphone to shout directly into the faces of pro-Israel protesters.
CLICK HERE TO GET THE FOX NEWS APP
""I don't know how many times I told him to take that out of my ear,"" Jonathan Oswaks, Kessler's friend and fellow protester, said of Alnaji's behavior. ""And I wasn't polite about it… He tried to bait me and I didn't take the bait. [Then] he walked across the street and tried to bait Paul.""
Another witness said that Alnaji was ""very aggressive"" at the scene.
""[Alnaji wanted] to maybe not kill or hurt [Kessler], but to get in his face and get into an altercation,"" the man, who asked not to be named, told Fox News Digital.
Alnaji's first appearance at Ventura County Superior Court is scheduled for Nov. 20.",www.foxnews.com,Pro-Palestinian protester arrested in death of Jewish man Paul Kessler,https://www.foxnews.com/us/pro-palestinian-protester-arrested-death-jewish-man-paul-kessler,en,2023-11-16 11:18:38,US,10,736,"['Death', 'Killing', 'Buildings', 'Buildings', 'Killing', 'Killing', 'Death', 'Death', 'Hostile_encounter', 'Terrorism', 'Killing', 'Killing']","['of a 69-year-old Jewish man', 'that', 'him', 'hospital', 'home', 'that', 'him', 'HUNDREDS', 'IN CLASH WITH PRO-PALESTINIAN PROTESTER', ""JEWISH MAN 'S"", 'AT CALIFORNIA', 'ELDERLY JEWISH MAN', 'IN CONFRONTATION WITH PRO-PALESTINIAN PROTESTER AT CALIFORNIA', 'WITH PRO-PALESTINIAN PROTESTER', 'AT CALIFORNIA', 'terrorist', 'OMITTING MAN', 'AT PRO-PALESTINIAN PROTEST', 'Alnaji', '[Kessler]']"
107,"In the past three months, 2 million Palestinians have been internally displaced by war. Some far-right Israeli officials want them to leave Gaza altogether — evoking the trauma of past displacement.","What Palestinians in Gaza may fear even more than Israeli bombardment
Enlarge this image toggle caption Ayman Oghanna for NPR Ayman Oghanna for NPR
BEIT HANINA AL-BALAD, Israeli-Occupied West Bank — Fatima Abu Dahouk sits on her porch on a rocky hillside in the rain, ruing the day in 1948 that her grandparents fled the farm that had been in their family for centuries, in what is now southern Israel.
""They thought they were leaving for only a month, maybe two,"" says Abu Dahouk, a 36-year-old mother of four. ""But promises were broken.""
They were never allowed back. Nor were the vast majority of Palestinians who fled or were expelled when Israel was created. Their homes were destroyed or given to Jewish refugees. Few, if any, received compensation for the loss of their land and property. Amnesty International says Israel has failed to recognize their right under international law to return to their land.
""We still have land deeds that data back to the Ottoman era,"" says Abu Dahouk's husband, Sakher Abu Dahouk, 56, whose relatives hail from the same area.
Since 1948, his extended family has moved several times — from what is now Beer Sheva, Israel, to Jordan, to the Israeli-occupied West Bank — as Israel seized territory in subsequent wars, redrew boundaries and built more Jewish settlements.
Enlarge this image toggle caption Ayman Oghanna for NPR Ayman Oghanna for NPR
That first displacement in 1948 set off a chain reaction — like dominoes falling, Fatima says — which has landed her here: A cinderblock house wedged between a sheep pen and a dry riverbed, behind a section of giant concrete barrier Israel built in 2002 after the second Palestinian intifada uprising.
Over the past three months, the vast majority of Palestinians in Gaza — some 2 million people — have been internally displaced by war, according to the United Nations. Some members of Israel's government want them to leave Gaza altogether.
But family histories like the Abu Dahouks' are why that idea hits such a nerve. It evokes the trauma of an earlier displacement that has become part of what it means to be Palestinian. That displacement reverberates through Palestinian music, culture and art. And it explains why people in Gaza — many, or perhaps most of whom have seen their homes destroyed — may refuse to relocate outside the Gaza Strip, even temporarily.
What Israeli officials have said about relocating Palestinians
In November, two Israeli lawmakers published an op-ed in the Wall Street Journal calling for ""countries around the world to accept limited numbers of Gazan families who have expressed a desire to relocate."" (The authors, current members of Israel's parliament, are from two different political parties. Danny Danon, from Prime Minister Benjamin Netanyahu's right-wing Likud Party, is a former Israeli ambassador to the U.N.; Ram Ben-Barak, from a centrist political party called Yesh Atid, is a former director of Israel's Mossad spy agency.)
The idea of ""voluntary migration"" of Palestinians from Gaza — defined as the resettlement abroad of those who are willing — has gained traction with at least two members of Prime Minister Benjamin Netanyahu's governing coalition.
""We have to further the solution of supporting the migration of Gazan residents,"" Israel's national security minister, Itamar Ben-Gvir, told a Jan. 3 news conference. ""It is a correct, just, moral, and humane solution.""
Israel's finance minister, Bezalel Smotrich, has also expressed support for the large-scale transfer of civilians from Gaza. Last month, he told Israeli media that the removal of around 90% of Palestinians from the area would make Israel safer.
""If there are 100,000 or 200,000 Arabs in Gaza and not 2 million, the whole discourse about the day after [the war ends] will be different,"" Smotrich was quoted as saying.
The U.S. State Department has called these comments ""inflammatory and irresponsible."" Both Smotrich and Ben-Gvir also live in West Bank settlements that the U.N. and U.S. consider to be illegally built on Palestinian land.
Netanyahu has distanced himself from his ministers' statements.
""Israel has no intention of permanently occupying Gaza or displacing its civilian population,"" he said in a video statement Jan. 10.
Enlarge this image toggle caption Ayman Oghanna for NPR Ayman Oghanna for NPR
What Palestinians in Gaza want
Civilians in Gaza, for their part, are just struggling to survive. Gaza health officials say more than 24,000 people have been killed in Israel's military operation in the Gaza Strip over the past three months, since the Oct. 7 Hamas-led attack that Israel says killed 1,200 people. The United Nations warns famine is imminent.
But many Palestinians say they've heard about Ben-Gvir and Smotrich's statements — and are alarmed.
""We refuse to allow history to repeat itself,"" Zakaria Basouni, 55, told NPR on Jan. 14 in Rafah, Gaza's southernmost city.
Basouni fled bombing in northern Gaza and was taking refuge in Rafah, which has absorbed more than 1 million internally displaced people since Oct. 7. He said he's determined not to flee any farther south to Egypt, even if the border opens.
He said he'd rather die in Gaza than leave his land.
""We've been evicted from our homes under fire,"" another evacuee from northern Gaza, 27-year-old Mohammed Subeh, told NPR in Rafah on the same day. ""It's just like our ancestors always told us, about how they lived in safety until they were suddenly dispersed to different countries.""
""I won't let it happen to my family again,"" Subeh said.
Aid agencies may have a dilemma
Even with many, perhaps most, of the residential buildings in Gaza destroyed, many Palestinians fear exile more than anything.
So even if aid agencies were to explore temporarily transferring Gaza's civilians abroad — either to keep them safe while Israel fights Hamas or to house them while rebuilding Gaza after the war — that prospect is likely to face fierce opposition from Palestinians themselves.
The U.N.'s humanitarian coordinator, Martin Griffiths, said Jan. 12 that some countries have ""offered to host civilians who want to leave Gaza, for their protection."" He didn't specify which countries.
Israeli media, citing unnamed sources, report that members of Netanyahu's government have held secret talks with officials from the Democratic Republic of Congo and other countries to discuss their possible willingness to absorb Palestinian refugees from Gaza. Congolese officials denied the reports, as did an Israeli official.
A British think tank run by former Prime Minister Tony Blair also denied as a ""lie"" an Israeli TV report that Blair met Netanyahu in late December to discuss a role in resettling Palestinians from Gaza.
The U.N.'s Griffiths says he's ""alarmed"" by any talk of transferring Palestinians out of Gaza.
""These statements [by Israeli ministers] raise grave concerns about the possible forcible mass transfer or deportation of the Palestinian population from the Gaza Strip, something that would be strictly prohibited under international law,"" Griffiths told the Security Council.
toggle caption Ayman Oghanna for NPR
Some Palestinians have been refugees for 76 years
In 1948, and again in 1967, Palestinians displaced from their lands were resettled in U.N. refugee camps in the West Bank and Gaza Strip. These areas are still dotted with camps, and they no longer feel temporary.
In fact, they're mostly indistinguishable from the urban streets around them. Palestinian refugee camps house schools, markets, mosques and U.N. offices. In the Al-Am'ari camp in the West Bank capital Ramallah, narrow passageways are spraypainted with graffiti celebrating Hamas and other militant groups.
That's where Mohammed Suleiman Khader, 84, has lived for 76 years — since he was 8 years old. He was born in an Arab village called Al-Na'ani, south of what is now Tel Aviv.
""I remember the Zionist gangs coming to our village, pressuring us to leave. We were the last family to go,"" Khader recalls, paging through an atlas of depopulated Arab villages. ""I remember it like yesterday. We left at 5 p.m., with our bedding on our backs.""
Enlarge this image toggle caption Ayman Oghanna for NPR Ayman Oghanna for NPR
The village was destroyed after his family left, he says. He couldn't go back.
""I still remember the watermelons we grew in our garden,"" Khader says, smiling.
He says his parents died with regrets that they didn't insist on staying on their land — come what may.
It's what many Palestinians in Gaza are weighing now, Khader says.
""What we felt then, our people are feeling again now,"" he says.
NPR producer Anas Baba contributed to this report from Rafah.",www.npr.org,What Palestinians in Gaza may fear even more than Israeli bombardment,https://www.npr.org/2024/01/17/1224889340/gaza-palestinian-displacement-israel-war,en,2024-01-17 12:45:00,US,11,1362,"['Buildings', 'Destroying', 'Hostile_encounter', 'Buildings', 'Buildings', 'Hostile_encounter', 'Quantified_mass', 'Buildings', 'Destroying', 'Quantified_mass', 'Hostile_encounter', 'Killing', 'Attack', 'Killing', 'Quantified_mass', 'Attack', 'Buildings', 'Attack', 'Quantified_mass', 'Buildings', 'Destroying', 'Hostile_encounter', 'Hostile_encounter', 'Destroying', 'Death', 'Quantified_mass']","['homes', 'Their homes', 'subsequent', 'cinderblock', 'house', 'section', 'of giant concrete barrier', 'many', 'homes', 'their homes', 'limited', 'numbers', 'of Gazan families who have expressed a desire to relocate', 'more than 24,000 people', ""in Israel's military operation in the Gaza Strip over the past three months, since the Oct. 7 Hamas-led attack that Israel says killed 1,200 people"", 'Oct. 7', 'that', '1,200 people', 'many', 'Palestinians', 'in northern Gaza', 'homes', 'We', 'many', 'of the residential buildings in Gaza', 'residential', 'buildings', 'in Gaza', 'many, perhaps most, of the residential buildings in Gaza', 'Israel', 'Hamas', 'The village', 'after his family left', 'his parents', 'many', 'Palestinians']"
