,description,maintext,source_domain,title,url,language,date_publish,region,title_len,text_len,all_frames,all_text_to_highlight
107,"Rescuers in Gaza don’t have the equipment to search properly for the living, let alone the dead","For free real time breaking news alerts sent straight to your inbox sign up to our breaking news emails Sign up to our free breaking news emails Please enter a valid email address Please enter a valid email address SIGN UP I would like to be emailed about offers, events and updates from The Independent. Read our privacy notice Thanks for signing up to the
Breaking News email {{ #verifyErrors }} {{ message }} {{ /verifyErrors }} {{ ^verifyErrors }} Something went wrong. Please try again later {{ /verifyErrors }}
The wreckage goes on for block after devastated block. The smell is sickening. Every day, hundreds of people claw through tons of rubble with shovels and iron bars and their bare hands.
They are looking for the bodies of their children. Their parents. Their neighbors. All of them killed in Israeli missile strikes. The corpses are there, somewhere in the endless acres of destruction.
More than five weeks into Israel’s war against Hamas, some streets are now more like graveyards. Officials in Gaza say they don’t have the equipment, manpower or fuel to search properly for the living, let alone the dead.
Hamas, the militant group behind the deadly Oct. 7 attack that killed about 1,200 people in Israel, has many of its bases within Gaza’s crowded neighborhoods. Israel is targeting those strongholds.
But the victims are often everyday Palestinians, many of whom have yet to be found.
Omar al-Darawi and his neighbors have spent weeks searching the ruins of a pair of four-story houses in central Gaza. Forty-five people lived in the homes; 32 were killed. In the first days after the attack, 27 bodies were recovered.
The five still missing were al-Darawi’s cousins.
They include Amani, a 37-year-old stay-at-home mom who died with her husband and their four children. There’s Aliaa, 28, who was taking care of her aging parents. There’s another Amani, who died with her 14-year-old daughter. Her husband and their five sons survived.
“The situation has become worse every day,” said the 23-year-old, who was once a college journalism student. The smell has become unbearable.
“We can’t stop,” he said. “We just want to find and bury them” before their bodies are lost in the rubble forever.
The Health Ministry in Hamas-run Gaza says the attacks have killed more than 11,200 people, two-thirds of them women and children. The U.N. humanitarian affairs office estimates that about 2,700 people, including 1,500 children, are missing and believed buried in the ruins.
The missing have added layers of pain to Gaza’s families, who are overwhelmingly Muslim. Islam calls for the dead to be buried quickly — within 24 hours if possible — with the shrouded bodies turned to face the holy city of Mecca. Traditionally, the body is washed by family members with soap and scented water, and prayers for forgiveness are said at the gravesite.
The search is particularly difficult in northern Gaza, including Gaza City, where Israeli ground forces are battling Hamas militants. Hundreds of thousands of people have fled southward, terrified by the combat and pushed by Israeli warnings to evacuate. But even in the south, continued Israeli airstrikes and shelling mean nowhere is safe in the tiny territory.
The Palestinian Civil Defense department, Gaza’s primary search-and-rescue force, has had more than two dozen workers killed and over 100 injured since the war began, said Mahmoud Bassal, the department spokesman.
More than half of its vehicles are now either without fuel or have been damaged by strikes, he said.
In central Gaza, outside the northern combat zone, the area's civil defense director has no working heavy equipment at all, including bulldozers and cranes.
“We actually don’t have fuel to keep the sole bulldozer we have operating,"" said Rami Ali al-Aidei.
At least five large bulldozers are needed just to search a series of collapsed high-rise buildings in the coastal town of Deir al-Balah, he said.
This means that bodies, and the desperate people searching for them, are not the focus.
“We’re prioritizing areas where we think we will find survivors,” said Bassal.
As a result, the search for bodies often falls to relatives, or to volunteers like Bilal Abu Sama, a former freelance journalist.
He ticks off a handful of Deir al-Balah’s victims: 10 corpses still lost in what is left of the al-Salam Mosque; two dozen bodies missing in a destroyed home; 10 missing in another mosque attack.
“Will those bodies remain under the rubble until the war ends? OK, when will the war end?” said Abu Sama, 30, describing how families dig through the wreckage without any tools. “The bodies will be decomposed. Many of them have already decomposed.”
On Tuesday, 28 days after an airstrike flattened his home, Izzel-Din al-Moghari found his cousin’s body.
Twenty-four people from his extended family lived in the home, in the Bureij refugee camp. All but three were killed.
Eight are still missing.
A civil defense bulldozer came three days after the strike to clear the road, then left quickly for another collapsed building. The bulldozer came again Tuesday and helped find al-Moghari's cousin.
After finding his cousin, al-Moghari went back into the wreckage in search of his father and other relatives.
""I am stunned,” he said. “What we lived through is indescribable.”
Gaza has become a place where many families are denied even the comfort of a funeral.
Al-Darawi, the man searching for his cousins, understands that.
“Those who found their dead are lucky,"" he said.",www.independent.co.uk,"Thousands of bodies lie buried in rubble in Gaza. Families dig to retrieve them, often by hand",https://www.independent.co.uk/news/gaza-ap-hamas-families-israeli-b2448939.html,en,2023-11-17 04:19:57,UK,17,877,"['Destroying', 'Quantified_mass', 'Killing', 'Attack', 'Destroying', 'Hostile_encounter', 'Killing', 'Attack', 'Killing', 'Quantified_mass', 'Quantified_mass', 'Buildings', 'Buildings', 'Killing', 'Attack', 'Death', 'Death', 'Attack', 'Killing', 'Hostile_encounter', 'Quantified_mass', 'Quantified_mass', 'Hostile_encounter', 'Attack', 'Killing', 'Hostile_encounter', 'Buildings', 'Quantified_mass', 'Attack', 'Hostile_encounter', 'Hostile_encounter', 'Quantified_mass', 'Attack', 'Buildings', 'Buildings', 'Killing', 'Attack', 'Buildings', 'Quantified_mass']","['block', 'hundreds', 'of people', 'All of them', 'in Israeli missile strikes', 'Israeli', 'missile', 'Israel ’s', 'against Hamas', 'Oct. 7', 'attack', 'deadly', 'Oct. 7', 'that', 'about 1,200 people', 'in Israel', 'many', 'of its bases', 'many', 'of whom', 'houses', 'in central Gaza', 'homes', '32', 'who', 'who', 'with her 14-year-old daughter', 'the attacks', 'more than 11,200 people, two-thirds of them women and children', 'where', 'Israeli ground forces', 'Hamas militants', 'Hundreds', 'of thousands of people', 'thousands', 'of people', 'continued', 'Israeli', 'more than two dozen workers', 'collapsed', 'high-rise', 'buildings', 'in the coastal town of Deir al-Balah', 'handful', 'of Deir al-Balah ’s victims', 'mosque', 'Many', 'of them', 'home', 'home', 'All but three', 'building', 'many', 'families']"
108,The PM was all smiles as he met the republican leader as powersharing government returned to Stormont this morning. But he later faced down a demand for a vote on Irish unity.,"Rishi Sunak warned new Sinn Fein First Minister Michelle O'Neill to concentrate on 'day-to-day issues in Northern Ireland as he welcomed her to her historic post.
The PM was all smiles as he met the republican leader as powersharing government returned to Stormont this morning.
But he later faced down a demand from the nationalists for a vote on Irish unity, after Ms O'Neill suggested one would happen within the next decade.
Speaking to broadcasters he said: 'It is not constitutional change, it is delivering on the day-to-day things that matter to people.'
The call for a referendum sparked a political row as the government in Northern Ireland returned after more than two years away, after the unionist DUP lifted its boycott.
The PM was all smiles as he met the republican leader as powersharing government returned to Stormont this morning.
But he later faced down a demand from the nationalists for a vote on Irish unity, after Ms O'Neill suggested one would happen within the next decade.
The DUP accused Ms O'Neill of focusing on 'divisive' issues rather than improving the lot of the people.
Irish premier Leo Varadkar refused to get involved on the side of Sinn Fein - his political rivals in Dublin.
Asked about the prospect of a reunification vote at a press conference in Stormont, he said: 'I think today is really about marking the fact that the Good Friday Agreement, which we voted for in big numbers north and south, is now functioning again.'
He added: 'I think today really should be about that rather than consitutional change.'
Ministers have already dismissed the prospect, insisting the conditions for holding a poll in the province are 'definitely not met'.
And the DUP accused Ms O'Neill of focusing on 'divisive' issues rather than improving the lot of the people.
The row overshadowed celebrations after powersharing was finally restored at Stormont at the weekend, following a deal with the unionists on post-Brexit trading rules.
Mr Sunak headed to Belfast last night and also met other NI party leaders and Irish premier Leo Varadkar this morning.
During the talks, it is understood the Sinn Fein leaders objected to elements of the recent UK deal with the DUP amid concerns it adopted a pro-Union approach to issues such as a border poll and the development of an all-island economy.
The republican party is understood to have made clear its intent to drive an all-island economy through the economy and finance departments it now holds in the newly-formed ministerial Executive in Belfast.
They also are believed to have stressed the requirement for the UK Government to remain impartial in relation to the calling of any future referendum on Northern Ireland's constitutional future.
The Israel-Hamas conflict was also spoken about, with Ms McDonald understood to have stressed the urgent need for a ceasefire and the need for international rule to be upheld in the region.
With elections due in Ireland this year, there is a real possibility that republicans could run governments on both sides of the border.
The Executive, headed by Ms O'Neill with the DUP's Emma Little-Pengelly serving as deputy First Minister, will hold its first meeting today as it begins the task of trying to manage Northern Ireland's strained finances.
The row could mar celebrations after powersharing was finally restored at Stormont at the weekend, following a deal with the unionists on post-Brexit trading rules
The institutions were restored after a deal between Mr Sunak's Government and the DUP to address unionist concerns over post-Brexit trading arrangements, which included passing new legislation at Westminster.
The UK Government's £3.3billion funding offer is aimed at stabilising finances in the region, and settling public sector pay claims.
The Executive will press Mr Sunak for more funding but he has described the package as 'a generous and fair settlement'.
Mr Heaton-Harris rejected claims by Stormont ministers that better funding is needed from the UK Government as powersharing returns.
The Cabinet minister insisted the £3.3billion package offered by Westminster is 'ample' for the Executive to 'get on with the job'.
On the calls for a referendum, Mr Heaton-Harris told LBC: 'I really don't think that's going to happen but as Secretary of State I am the person responsible in Government to check whether the conditions for that have been met.
'They're definitely not met at this point in time, and I would suggest that actually top of the in-tray for an incoming Executive has to be things like public sector pay, the health service, which needs massive transformation here, funding on education and a whole host of other things that actually all people in Northern Ireland from both communities truly care about.'
He said he would have to be 'confident' that there was a potential majority of people in Northern Ireland 'who would like to depart from their current constitutional status' for the conditions to be met.
Mr Heaton-Harris is joining Rishi Sunak and Irish premier Leo Varadkar in Belfast on Monday to mark the restoration of devolved government.
But the newly-formed Executive has already written to the Prime Minister calling for urgent discussions on long-term funding stability to deliver public services.
Asked about claims that the current funding arrangement will not provide the basis for the Executive to deliver sustainable public services, the Northern Ireland Secretary told BBC Breakfast: 'I don't believe that is the case. I think Stormont has fantastic, strong foundations now and it will survive, it will be sustainable.'
He added: 'There is a thing, I think, about choices. You're going into politics, you have to make choices on these sorts of things.
'Those choices haven't been made for a long time out here, and I believe the new set of ministers are completely capable of running their public finances perfectly well with the fair and generous funding package we've given them.
Ms O'Neill (left) has been installed as First Minister, while the DUP's Emma Little-Pengelly (right) is deputy
'There's a £3.3billion package available to ministers on day one here to get on with the job of sorting out Northern Ireland public sector pay, health services and a whole host of other things, and I'd say that's ample for the time being.'
Mr Sunak and Mr Varadkar will meet each other, as well as the leaders of the new powersharing Executive which was formed on Saturday, ending two years of political stalemate.
Ms Little-Pengelly said Stormont ministers will be 'speaking with one voice' in their talks with the Prime Minister.
She added: 'We will be saying that the people of Northern Ireland deserve better public services and that we need to work together – the Executive and the Government – to deliver long-term fiscal stability.
'We are ready to engage with the Government and get down to the work of putting our finances on a sound footing; however, we will also be seeking to ensure the UK Government provides sufficient funding in a package to fulfil its promises on public sector pay.'",www.dailymail.co.uk,From a handshake to a slap down over Irish unity vote: Rishi Sunak tells Sinn Fein's Michelle O'Neill to concentrate on 'day-to-day' concerns of people in Northern Ireland as she becomes First Ministe,https://www.dailymail.co.uk/news/article-13046747/Irish-unity-vote-Rishi-Sunak-Sinn-Fein-Michelle-ONeill-Northern-Ireland.html?ns_mchannel=rss&ns_campaign=1490&ito=1490,en,2024-02-05 12:31:55,UK,33,1123,"['Firing', 'Hostile_encounter', 'Quantified_mass', 'Quantified_mass', 'Hostile_encounter']","['Ministers', 'already', 'the prospect', 'Israel-Hamas', 'all', 'people', 'both', 'communities', 'political']"
109,The Labour leader responds to pressure over his stance on a ceasefire ahead of a Commons vote.,"Mr Sarwar said Labour had been in touch with the SNP's whips about the wording of the ceasefire motion that will be voted on this Wednesday. However, the SNP's chief whip, Owen Thompson, denied there had been any contact.",www.bbc.co.uk,Sir Keir Starmer calls for Gaza 'ceasefire that lasts',https://www.bbc.co.uk/news/uk-politics-68331322?at_medium=RSS&at_campaign=KARANGA,en,2024-02-18 12:21:51,UK,9,39,[],[]
100,,"New York, SANA- Russia and China have vetoed a US draft resolution at the UN Security Council that did not call for a ceasefire in the besieged Gaza Strip.
“The US draft resolution was not balanced and does not reflect the required call for a ceasefire, and therefore it cannot be allowed to pass because it will completely make the Council lose its credibility,” Russia Today website quoted Russia’s Permanent Representative to the United Nations, Vasily Nebenzia, as saying during a Security Council session.
In turn, the Chinese Representative to the Security Council stressed that the US draft resolution equates the victim with the executioner, and does not reflect the required call for a ceasefire.
The Chinese diplomat called for opening humanitarian corridors, delivering aid to the Gaza Strip, and preventing the forced displacement of its people.
Manar Salameh/ Ruaa al-Jazaeri",sana.sy,Russia and China veto a draft US resolution regarding Israeli aggression on Gaza Strip,https://sana.sy/en/?p=319346,en,2023-10-01 00:00:00,ME,14,137,"['Attack', 'Attack', 'Attack']","['Intensified', 'on Rafah, where more than half of Gaza ’s population are crammed into less than 20 per cent of the Gaza Strip', 'its', 'next', 'military', 'there']"
101,"TEHRAN, Nov. 19 (MNA) – The Iranian Foreign Ministry condemned the Zionist regime’s military attack that resulted in the martyrdom of Deputy Speaker and Acting Speaker of the Palestinian Legislative Council Ahmed Bahr.","In a statement on Saturday, Nasser Kan'ani offered condolences over the loss of Bahr to the leadership of the Hamas Resistance movement, the Palestinian people, and the family of the late figure.
He stressed that the apartheid Zionist regime has once again exposed its evil, murderous, and inhumane nature to the whole world by killing Bahr and thousands of other Palestinians in the Gaza Strip and the West for over 40 days, the Foreign Ministry’s website reported.
Kan'ani noted that undoubtedly, such crimes will not weaken the firm determination of the Palestinian people and Resistance movements to keep fighting on the path to the liberation of their land from the Zionist occupiers.
He called on the international assemblies, organizations, and institutions to fulfill their responsibilities and take immediate deterrent measures to stop the targeted killing machine and organized terrorism of the Zionist regime against the Palestinian people and to hold the Zionist criminals accountable before justice and international law.
The Acting Speaker of the Palestinian Legislative Council Ahmed Bahr died on Friday as a result of his wounds from an airstrike during the attack launched by the Israeli regime's forces on the Gaza Strip.
On October 23, his wife and children were martyred when the Israeli aircraft bombed their house.
SD/TSN",en.mehrnews.com,Iran condemns Israeli killing of PLC speaker Ahmad Bahr,https://en.mehrnews.com/news/208510/Iran-condemns-Israeli-killing-of-PLC-speaker-Ahmad-Bahr,en,2023-11-19 07:15:00,ME,9,205,"['Attack', 'Hostile_encounter', 'Hostile_encounter', 'Killing', 'Attack', 'Attack', 'Attack', 'Hostile_encounter', 'Hostile_encounter', 'Hostile_encounter', 'Committing_crime']","['the United States and the UK', 'Yemen', 'direct', 'the US and British warplanes', 'at least five people', 'it', 'against a radar site that belonged to the Ansarullah Resistance movement in Yemen ’s capital', 'against vessels heading to ports', 'in occupied Palestine', 'against the Palestinian people in the Gaza Strip', 'ongoing', 'Gaza', ""Israel's"", 'crimes', 'in Gaza']"
102,,"Figures from Euro-Med Monitor estimate that Israel’s renewed aggression against the besieged Strip has seen the occupational force detain at least 3,000 civilians.
Following the abduction of an infant Palestinian girl from the Gaza Strip by an Israeli soldier, Palestine’s Ministry of Foreign Affairs and Expatriates has denounced the kidnapping as the most heinous crime and called on Israel for her immediate safe return.
In a series of posts via X on Monday, Muhammad Shehada, Euro-Mediterranean Human Rights Monitor’s Communications Chief, exposed Israel’s media for glorifying the abduction of the unidentified Palestinian infant by Captain Harel Itach.
🚨An Israeli officer kidnapped a BABY girl from Gaza & brought her to Israel (parents likely killed) per a friend of his
Capt. Harel Itach was killed & the identity & whereabouts of the kidnapped baby are unknown
Israel’s Army Radio deleted the tweet that mentioned the incident pic.twitter.com/m5FKcL84ZJ — Muhammad Shehada (@muhammadshehad2) January 1, 2024
In since-deleted posts from Israel’s Army Radio uploaded by Shehada, Itach is revealed to have abducted the infant from the besieged Strip, which his army has indiscriminately decimated. It is thought that her parents have been killed amid Israel’s onslaught.
According to Middle East Monitor, Itach has died, and the whereabouts of Palestine’s abducted infant girl now remain unknown.
In response, via a communique addressed to Israel on X, Palestine’s Foreign Ministry has said that this instance is further proof of the occupying forces’ genocidal and expansionist aspirations.
Her kidnapping, “deepens our conviction that the occupation army is committing the most horrific crimes of genocide, abuse, direct killing, and kidnapping against defenceless civilians,” Palestine’s MoFA statement said.
The ministry is especially concerned for her welfare, given the clandestine nature by which she was taken.
“What is the child’s health condition? Is she receiving necessary medical attention?” MoFA asked.
In addition to calling on Israel for transparency on the child’s condition, MoFA’s communique “calls on the Israeli side to quickly answer these and other questions and officially hand over the child to the Palestinian National Authority immediately.”
In a news release on December 26, Euro-Med estimated that at least 3,000 Palestinian civilians, including women and children, have been abducted from their homes and shelters in Gaza by the occupation.
“The Israeli army has been detaining hundreds of Palestinians in the Sheikh Radwan neighbourhood in Gaza City. Among them are dozens of women who were taken to Yarmouk Stadium, where they had their veils removed and were searched by soldiers,” the news release said.
Euro-Med added that among the males unlawfully detained, some are as young as ten and as old as 70, or even older. Israel is also inflicting humiliation upon them, by forcing them to remove their clothing, except for their underwear.
International human rights watchdog Amnesty International‘s Crisis Investigation team have surveyed and verified photographs and footage of unlawfully held Palestinian detainees experiencing torture and humiliation.
Worse still, on December 5, Physicians for Human Rights Israel confirmed that since October 7, six Palestinians died while in Israeli detention.
Amnesty has called for an urgent investigation into Israel’s breach of international law.
“All those detained arbitrarily must be released,” said Amnesty’s Regional Director for the Middle East and North Africa, Heba Morayef.
“Israel has an appalling track record of impunity for violations by its forces, underscoring the urgent need for an independent effective investigation into all deaths in custody,” she added.",dohanews.co,Palestine’s Foreign Ministry demands Israel immediately return abducted baby girl,https://dohanews.co/palestines-foreign-ministry-demands-israel-immediately-return-abducted-baby-girl/,en,2024-01-03 11:08:04,ME,10,544,[],[]
