,description,maintext,source_domain,title,url,language,date_publish,region,title_len,text_len,all_frames,all_text_to_highlight
108,"An executive with the Football Association (FA), has resigned after saying Hitler would be proud of Israeli President Benjamin Netanyahu.","An executive with the Football Association (FA), the group that oversees the English Premier League, has resigned from his position after a social media post in which he claimed that Hitler would be proud of Israeli President Benjamin Netanyahu.
Wasim Haq, who had already been serving a suspension for the inflammatory November 11 post, officially resigned on Thursday.
In the post, which Haq deleted, he wrote, “Netanyahu has sacrificed his own people to maintain power…whilst #Palestinians are trying to maintain their sanity. Adolf Hitler would be proud of Benjamin Netanyahu.”
In a subsequent post, Haq denied being an antisemite.
In his resignation, Haq chalked his post up to “heightened emotions.”
“It is with great sadness that I inform you of my decision to resign as a member of the FA Council with immediate effect,” Haq said.
“As someone who has worked closely with many Jewish people over the years and created meaningful and valued friendships, the most painful part of this process is knowing that some of those friends and colleagues may not forgive me for the misunderstanding and hurt I have unintentionally caused. I take full responsibility and reiterate my apology to them and all those affected.”
Haq says that the real target of his post was Netanyahu, not the Israeli people.
“In expressing those feelings, I chose the wrong words entirely and that has impacted the leadership position that I hold at the FA,” he explained.
“Following the Oct. 7 attacks by Hamas there are heightened emotions all around. I, like millions of others, have been deeply disturbed by the huge loss of life, this war has become a painful slaughter of innocent adults and children – a war that humanity should have avoided.”
In addition to his resignation, “Haq has also been sacked from his role as an independent councilor at the Lawn Tennis Association (LTA), the national governing body of tennis in Great Britain, while he is also being investigated by England Golf, where he holds a role similar to that at the FA,” Reuters reports.",www.breitbart.com,English Soccer Exec Resigns After Posting 'Hitler Would Be Proud of Benjamin Netanyahu',https://www.breitbart.com/sports/2023/11/23/english-soccer-exec-resigns-after-posting-hitler-would-be-proud-of-benjamin-netanyahu/,en,2023-11-24 03:35:03,US,13,330,"['Quantified_mass', 'Attack', 'Hostile_encounter', 'Hostile_encounter', 'Firing']","['many', 'Jewish people', 'Oct. 7', 'by Hamas', 'that humanity should have avoided', 'Haq', 'from his role as an independent councilor at the Lawn Tennis Association (LTA), the national governing body of tennis in Great Britain']"
109,"Cameron, who triggered the country's exit from the European Union, returns as U.K.'s foreign secretary. Hardliner Home Secretary Suella Braverman was fired in the same cabinet shakeup.","Ex-Prime Minister David Cameron makes shocking return to U.K. government
Enlarge this image toggle caption James Manning/AP James Manning/AP
LONDON — Former British Prime Minister David Cameron made an unexpected return to high office on Monday, becoming foreign secretary in a major shakeup of the Conservative government that also saw the firing of divisive Home Secretary Suella Braverman.
Cameron, who led the U.K. government between 2010 and 2016 and triggered the country's exit from the European Union, was appointed by Prime Minister Rishi Sunak in a Cabinet shuffle in which he sacked Braverman, a law-and-order hardliner who drew anger for accusing police of being too lenient with pro-Palestinian protesters.
She was replaced by James Cleverly, who had been foreign secretary. Sunak was making further changes to the government throughout the day, with Environment Secretary Therese Coffey saying she would be leaving her job.
The bold changes are an attempt by Sunak to reset his faltering government. The Conservatives have been in power for 13 years, but opinion polls for months have put them 15 to 20 points behind the opposition Labour Party amid a stagnating economy, persistently high inflation, an overstretched health care system and a wave of public sector strikes.
Cameron's appointment came as a surprise to seasoned politics-watchers. It's rare for a non-lawmaker to take a senior government post, and it has been decades since a former prime minister held a Cabinet job.
The government said Cameron had been appointed to Parliament's unelected upper chamber, the House of Lords. The last foreign secretary to serve in the Lords, rather than the elected House of Commons, was Peter Carrington, who was part of Prime Minister Margaret Thatcher's government in the 1980s.
Cameron, 57, said Britain was ""facing a daunting set of international challenges, including the war in Ukraine and the crisis in the Middle East.""
""While I have been out of front-line politics for the last seven years, I hope that my experience — as Conservative leader for 11 years and prime minister for six — will assist me in helping the prime minister to meet these vital challenges,"" he said in a statement.
Cameron's foreign policy legacy is mixed. As prime minister he backed NATO-led military intervention in Libya in 2011 that toppled Moammar Gadhafi and deepened that country's chaos. In 2013, he tried and failed to gain Parliament's backing for U.K. airstrikes against President Bashar al-Assad's forces in Syria. He also announced a short-lived ""golden era"" in U.K.-China relations, shortly before that relationship soured.
And he will be forever remembered as the unwitting author of Brexit, a rupture that roiled Britain's politics, economy and place in the world. Cameron called a 2016 EU membership referendum, confident the country would vote to stay in the bloc. He resigned the day after voters opted to leave.
Enlarge this image toggle caption Maja Smiejkowska/AP Maja Smiejkowska/AP
Bronwen Maddox, director of international affairs think-tank Chatham House, said Cameron ""will bring undoubted strengths into the top team and to the U.K.'s relationships abroad,"" where many will welcome ""a heavyweight and moderate foreign secretary.""
""The concern must be, however, that these could be outweighed by the controversial legacy he brings too,"" she said.
Sunak was a strong backer of the winning ""leave"" side in the referendum. But his decision to appoint Cameron and sack Braverman is likely to infuriate the Conservative Party's right wing and inflame tensions in the party that Sunak has sought to soothe.
Prominent right-wing lawmaker Jacob Rees-Mogg said sacking Braverman was ""a mistake, because Suella understood what the British voter thought and was trying to do something about it.""
Sunak had been under growing pressure to fire Braverman — a hard-liner popular with the party's authoritarian wing — from one of the most senior jobs in government, responsible for handling immigration and policing.
In a highly unusual attack on the police last week, Braverman said London's police force was ignoring lawbreaking by ""pro-Palestinian mobs."" She described demonstrators calling for a cease-fire in Gaza as ""hate marchers.""
Enlarge this image toggle caption Alastair Grant/AP Alastair Grant/AP
On Saturday, far-right protesters scuffled with police and tried to confront a large pro-Palestinian march by hundreds of thousands through the streets of London. Critics accused Braverman of helping to inflame tensions.
Last week, Braverman wrote an article for the Times of London in which she said police ""play favorites when it comes to protesters"" and acted more leniently toward pro-Palestinian demonstrators and Black Lives Matter supporters than toward right-wing protesters or soccer hooligans.
The article was not approved in advance by the prime minister's office, as would usually be the case.
Braverman said Monday that ""it has been the greatest privilege of my life to serve as home secretary,"" adding that she would ""have more to say in due course.""
Braverman, a 43-year-old lawyer, has become a leader of the party's populist wing by advocating ever-tougher curbs on migration and a war on human rights protections, liberal social values and what she has called the ""tofu-eating wokerati."" Last month she called migration a ""hurricane"" that would bring ""millions more immigrants to these shores, uncontrolled and unmanageable.""
As home secretary, Braverman championed the government's stalled plan to send asylum-seekers who arrive in Britain in boats on a one-way trip to Rwanda. A U.K. Supreme Court ruling on whether the policy is legal is due on Wednesday.
Critics say Braverman has been building her profile to position herself for a party leadership contest that could come if the Conservatives lose power in an election expected next year.
Last month Sunak tried to paint his government as a force of change, saying he would break a ""30-year status quo"" that includes the governments of Cameron and other Conservative predecessors.
""A few weeks ago, Rishi Sunak said David Cameron was part of a failed status quo. Now he's bringing him back as his life raft,"" said Labour lawmaker Pat McFadden.
As well as bringing about Brexit, Cameron's government imposed years of public-spending cuts after the 2008 global financial crisis that have frayed the country's welfare system and state-funded health service. After leaving office he was caught up in a scandal over his lobbying for Greensill Capital, a financial services firm that later collapsed.
Tim Bale, professor of politics at Queen Mary University of London, said Cameron's appointment was a sign of the government's ""desperation.""
""It's difficult to believe that this is going to impress voters, whether they are convinced Brexiteers who despise David Cameron for being a remainer, or convinced remainers who despise David Cameron for holding and losing a referendum,"" he said.",www.npr.org,Ex-Prime Minister David Cameron makes shocking return to U.K. government,https://www.npr.org/2023/11/13/1212603952/david-cameron-suella-braverman-uk-government,en,2023-11-13 09:52:28,US,10,1065,"['Firing', 'Buildings', 'Hostile_encounter', 'Attack', 'Firing', 'Firing', 'Firing', 'Attack', 'Hostile_encounter', 'Quantified_mass', 'Quantified_mass', 'Hostile_encounter', 'Hostile_encounter']","['he', 'Braverman, a law-and-order hardliner who drew anger for accusing police of being too lenient with pro-Palestinian protesters', 'House', 'of Commons', 'in Ukraine', 'U.K.', ""against President Bashar al-Assad's forces in Syria"", 'his', 'Braverman', 'Braverman', 'Sunak', ""Braverman — a hard-liner popular with the party's authoritarian wing"", 'from one of the most senior jobs in government, responsible for handling immigration and policing', 'on the police', 'last week', 'On Saturday', 'far-right protesters', 'with police', 'hundreds', 'of thousands', 'thousands', 'on human rights protections, liberal social values and what she has called the ""tofu-eating wokerati', 'over his lobbying for Greensill Capital, a financial services firm that later collapsed']"
100,Palestinians abroad tell the BBC multiple generations of their families were killed in Gaza air strikes.,"His sister Aya had gone there to take shelter with her children after her own apartment was damaged by an air strike. His other sisters, Walaa and Alaa, were there too with their children. The house was in the centre of Gaza in the town of Deir al-Balah, an area that had never been targeted before. They thought it was safe.",www.bbc.co.uk,Gaza casualties: 'Most of the children in my family photo are dead',https://www.bbc.co.uk/news/world-67273969?at_medium=RSS&at_campaign=KARANGA,en,2023-11-11 01:16:27,UK,12,61,"['Attack', 'Buildings']","['air', 'house']"
101,"Carlton Reid is still managing to make a living as a travel writer, despite a self-imposed flight ban.
His last flight was in March 2020 - and he's managed to keep his head above water ever since.","Last week, I turned down a luscious invite to Abu Dhabi, complete with a business-class flight and a five-star hotel. Was I mad? Yes, mad about runaway climate change, and so, despite being a travel writer, I’ve stopped flying.
Being a travel writer that doesn’t fly is deemed so exotic that I was the second story on Monday’s As It Happens, a 55-year-old radio news show aired by Canada’s national broadcaster.
The incredulous CBC host asked me when I’d quit. It was a decision brought on by the pandemic, I replied.
My last flight was in March 2020, returning from Israel on a group press trip to Palestine. As we landed at Heathrow, and our phones started pinging with the latest news, I remember talking, incredulously, about the likelihood of lockdowns with my fellow travel writers. Days later came the first stay-at-home order, and I, like many other people, started maxing out credit cards to survive: no travel, no articles, no cash.
Pivoting to other forms of journalism — including reporting on the Covid-19 bicycle boom and its likely post-pandemic crash — I kept my head above water.
Travel writer Carlton Reid (above) last flew in March 2020. Now he travels everywhere by bike, train and electric car
When flight restrictions were gradually lifted, many people - including travel writers — were desperate to fly again, but I wasn’t so fussed. It wasn’t fear of travelling in a 500-mile-per-hour aluminium tube in close proximity to loosely masked coughing passengers - it was the fear of a heating planet.
For solid scientific reasons, I’d felt guilty about air travel for some time.
Our average CO2 output in the UK is roughly 10 tonnes a year per person, and we need to aim for lower than five tonnes per year.
Our family has an electric car powered by rooftop solar panels, and I usually cycle rather than drive, so there’s little fat to trim from my domestic travel.
Quitting flying led to an immediate and significant drop in my carbon emissions.
I still travel to exotic locations. As reported in the Mail, I’ve taken high-speed trains and ferries to Malta and Ibiza.
When I travelled to the recent Champion’s League match between Paris St. Germain and Newcastle United, I took the LNER train to London from the North East, linking up with the Eurostar to reach the City of Light.
According to Eurostar, this journey’s London to Paris leg used 2.4kgs of CO2 per person. Flying between the capitals emits 66kgs per person. Taking the train reduces emissions by a whopping 96 per cent. In the Netherlands, the Eurostar to Amsterdam is powered by electricity entirely generated from wind, and in the UK, that figure is 40 per cent and rising.
Carlton explains that when he travelled to the recent Champion’s League match between Paris St. Germain and Newcastle United, he took an LNER train to London from the North East, linking up with the Eurostar to reach the City of Light
Understandably, the availability of cheap flights makes it a no-brainer for most people to travel by air, but there’s still a cost, and that cost — measured in CO2 emissions — is helping to fuel climate change. We need to reduce our annual emissions, and while not everybody will ever go full hairshirt by becoming flight-free, more long-distance travel can and should be done over the ground.
It’ll take longer to get to Australia, but there’s no Planet B.
Carlton can be found tweeting at @carltonreid and his videos can be found at www.youtube.com/@cyclingnews.",www.dailymail.co.uk,I'm a travel writer and here's why I've stopped flying - completely - and how I still visit places to write about,https://www.dailymail.co.uk/travel/article-12889093/Im-travel-writer-heres-Ive-stopped-flying-completely-visit-places-write-about.html?ns_mchannel=rss&ito=1490&ns_campaign=1490,en,2023-12-21 09:25:12,UK,22,577,"['Buildings', 'Quantified_mass', 'Quantified_mass', 'Quantified_mass']","['five-star', 'hotel', 'many', 'other people', 'many', 'people', 'cost', 'in CO2 emissions']"
102,"Gogglebox viewers have taken to social media to express their dismay at the ‘bad timing’ of the show’s new series last night (16 February), after an emotional tribute was aired straight after a sex toy segment. A clip played from a Valentine’s day episode of This Morning showing off the latest raunchy gadgets, before the episode cut to a tribute to cast member Pat Webb, who died recently. “Lovely tribute. Bad timing. Maybe should have done it at end of titles”, one viewer posted on X (formerly Twitter), echoing the thoughts of many, who jumped in to agree.","Gogglebox viewers have taken to social media to express their dismay at the ‘bad timing’ of the show’s new series last night (16 February), after an emotional tribute was aired straight after a sex toy segment.
A clip played from a Valentine’s day episode of This Morning showing off the latest raunchy gadgets, before the episode cut to a tribute to cast member Pat Webb, who died recently.
“Lovely tribute. Bad timing. Maybe should have done it at end of titles”, one viewer posted on X (formerly Twitter), echoing the thoughts of many, who jumped in to agree.",www.independent.co.uk,Gogglebox airs emotional tribute straight after sex toy segment,https://www.independent.co.uk/tv/lifestyle/gogglebox-mummy-pat-death-tribute-b2497963.html,en,2024-02-17 15:59:22,UK,9,96,"['Death', 'Quantified_mass']","['who', 'recently', 'many']"
103,Lineker shared the post from a Pro-Palestinian account on Monday that called for international sporting bodies to ban Israel from competitions amid on the ongoing conflict in the Middle East.,"Former Chelsea boss Avram Grant has lashed out at Gary Lineker on Instagram after the BBC presenter shared an anti-Israel post on social media.
Lineker shared the post from a Pro-Palestinian account on Monday that called for international sporting bodies to ban Israel from competitions amid on the ongoing conflict in the Middle East.
He later removed the post because of an apparent misunderstanding, but the Israeli-born Grant has been left furious and launched an attack on the Match of the Day host.
'Hi @garylineker, so you have done it again. You are retweeting the chairman of the Palestine FA,' Grant wrote on Instagram.
'The same man who publicly supported the October 7 massacre and said it was a great day that should happen again and again.
Avram Grant has slammed Gary Lineker for sharing an anti-Israel post on social media
Lineker shared the post calling for Israel to be banned from sporting competitions before later removing it
Grant is furious that Lineker shared it, and has hit out at him for not condemning Hamas
Your browser does not support iframes.
'I pray for peace, but these people don't want peace.
'They killed babies. They raped women. They burnt people alive. They filmed it all. A massacre which you were completely silent about.'
Grant previously called out Lineker for his response to the attack by Hamas on Israel back in November.
He slammed Lineker for remaining 'silent' and insisted his respect for the ex-England striker had 'gone'.
The deadly attack saw over 1,200 people killed and 250 kidnapped, but Lineker did not issue a statement condemning it, and instead tweeted about his former club Tottenham on the same day.
Grant accused Lineker of having a 'double standard', referring to how he has not been afraid to voice his opinion on global affairs in the past.
Lineker was stood down from Match of the Day presenting duties last March after comparing the language used by then-Home Secretary Suella Braverman when talking about migration to that used in 1930s Germany.
He was reinstated just days later following public backlash, but Grant claimed the October 7 attacks were comparable to German policy in the 1930s and was angered that Lineker did not show support for Israel.
'I follow Gary, he comments about everything, he even said that the current policy of the UK Government reminded him of the policy of the German government in the 1930s,' Grant said.
Lineker tweeted about Tottenham on October 7 but did not post about the attack on Israel by Hamas
The attacks on October 7 killed 1,200 people and has sparked a bloody conflict
IT'S ALL KICKING OFF! It's All Kicking Off is an exciting new podcast from Mail Sport that promises a different take on Premier League football. It is available on MailOnline, Mail+, YouTube, Apple Music and Spotify. Your browser does not support iframes. Advertisement
'I know about this policy, my father suffered for this policy, my grandfather, my grandmother was murdered because of the policy of the Germans.
'The only thing that is close to his is what happened on October 7. What happened, I cannot even describe. There was no reason, there was a peaceful environment in the Middle East.
'But they murdered and butchered children, they beheaded people, raped women and burned them alive, cut open women and took (unborn) children out of their stomachs and killed them. They took hostages.
'I've never heard of such things in my life, and what did you do? Silence. Nothing. I think you even said that Tottenham is first place in the league. That's what was important for you. So you have a double standard.'",www.dailymail.co.uk,Former Chelsea manager Avram Grant attacks Gary Lineker for his anti-Israel post on Instagram and accuses him of being 'totally silent about a massacre where babies were killed and women were raped',https://www.dailymail.co.uk/sport/football/article-12968379/Former-Chelsea-manager-Avram-Grant-attacks-Gary-Lineker-anti-Israel-post-Instagram-accuses-totally-silent-massacre-babies-killed-women-raped.html?ns_mchannel=rss&ns_campaign=1490&ito=1490,en,2024-01-16 10:59:27,UK,32,586,"['Hostile_encounter', 'Attack', 'Killing', 'Killing', 'Killing', 'Attack', 'Killing', 'Attack', 'Killing', 'Attack', 'Attack', 'Attack', 'Killing', 'Hostile_encounter', 'Killing', 'Killing', 'Killing', 'Killing', 'Killing']","['ongoing', 'in the Middle East', 'the Israeli-born Grant', 'on the Match of the Day host', 'October 7', 'They', 'babies', 'by Hamas', 'on Israel', 'back in November', 'attack', 'deadly', 'over 1,200 people', 'October 7', 'on Israel', 'by Hamas', 'on October 7', 'The attacks on October 7', '1,200 people', 'bloody', 'my grandmother', 'because of the policy of the Germans', 'they', 'children', 'they', 'children', 'they', 'people', 'they', 'them']"
